URL,Pavadinimas,Aprašymas,Telefonas,Svetainė,El. paštas,Adresas
https://www.trustedshops.de/bewertung/info_X16AE36093C7AABEB598B22D499FE2D1D.html,tischideen-und-ambiente.de,"Als einer der führenden Onlinehändler der gehobenen Tischkultur hilft Ihnen Tischideen & Ambiente jede Mahlzeit des Tages zu zelebrieren und die Zeit in Ihrem schön dekorierten Zuhause noch mehr zu genießen. Erleben Sie den stilvollen Genuss des Essens mit all Ihren Sinnen. Auf 600 qm bieten wir professionelle Beratung und eine breite Auswahl qualitativ hochwertiger und namhafter Marken für Ihre Tischkultur. Wir bieten Ihnen für jeden Stil und jede Saison das passende Markengeschirr und Besteck, sowie Gläser und Dekorationen. Lassen Sie sich in unserem Showroom in Leipferdingen inspirieren. Gerne beraten wir Sie auch persönlich und präsentieren Ihnen unser umfangreiches Sortiment. Entdecken Sie Ihre Lieblingsstücke für Ihr Zuhause.""",+497708230000,http://www.tischideen-und-ambiente.de,shop@tischideen-und-ambiente.de,Birgit Fluck Poststrasse 29 78187 Geisingen Deutschland
https://www.trustedshops.de/bewertung/info_X91C18069FA4E4C0ADC6BDACD6F54BF08.html,ritterladen.de,"Ritterladen ist seit 1999 der Shop für Mittelalter und LARP. Hier erhalten Sie eine riesige Auswahl aller Mittelalter Marken & Hersteller aus einer Hand. Er ist bekannt für schnellen Versand (""heute bestellt - morgen verschickt""), freundlichen Kundenservice und 30 Tage Widerrufsrecht. Das Sortiment reicht von Mittelalter Bekleidung und Wikinger Kleidung (Mittelalter Kleider, Tuniken, Hosen, Umhänge, Schuhwerk, Maßanfertigungen,...) über Accessoires, Schmuck und einem umfangreichen Met-Sortiment bis hin zu Trinkhörnern, Geschirr, Ausrüstung fürs Lager und Rüstzeug. Auch für Kinder findet sich hier die passende Mittelalter Gewandung, Holzschwerter und vieles mehr. Vielerlei Geschenkideen für Mittelalter- und LARP-Enthusiasten gibt es im Ritterladen ebenfalls: z.B. individuelle Namensgravuren auf Trinkhörner oder Holzschwerter. Der Ritterladen hat seinen Sitz in der Mitte Deutschlands, in Hessen. Hier gibt es auch die Möglichkeit für Kunden, den Lagerverkauf zu besuchen. Informationen zum Lagerverkauf finden Sie unter ritterladen.de/Lagerverkauf",+496051967080,http://ritterladen.de,info@ritterladen.de,Ritterladen GmbH Robert-Bosch-Straße 16b 63584 Gründau-Lieblos Deutschland
https://www.trustedshops.de/bewertung/info_XDCD5808C26B277A4A069C83EBC119FDE.html,trachtenmode.eu,"Wir sind ein kleines Unternehmen mitten im Herzen von Bayern, das seit 2010 seine Kundinnen und Kunden im Bereich Trachtenmode glücklich macht. Trachten sind unsere Leidenschaft – und die wollen wir gerne mit Dir teilen. Vom Dirndl bis zur Lederhose: Wir statten Damen, Herren und selbstverständlich auch Kinder mit modischen, trendigen Trachten für jeden Anlass aus. Der Großteil unserer hochwertigen Produkte wird direkt in unserer eigenen Schneiderei in Regensburg entworfen und mit viel Liebe zum Detail von unseren Produzenten gefertigt. Wir führen außerdem eine exklusive, hauseigene und limitierte Made in Germany Dirndl-Kollektion, die wir in unserer Schneiderei designen und produzieren – modisch und immer im aktuellen Trachten-Trend. Ob traditionell oder elegant: In unserem umfangreichen Sortiment ist für jeden Geschmack das Passende dabei. Und das Beste: Du kannst unsere Trachten günstig kaufen, ohne dabei auf hochwertige Qualität zu verzichten. Denn wir von Edelnice sind für unser top Preis-Leistungs-Verhältnis bekannt!",+4994138105596,http://www.trachtenmode.eu,service@trachtenmode.eu,Edelnice Trachtenmode GmbH & Co. KG Hermann-Köhl-Str. 3b 93049 Regensburg Deutschland
https://www.trustedshops.de/bewertung/info_XDF0C709F3190416EEC72EAAA19D4A9A4.html,Krüger Dirndl Onlineshop,"Krüger Dirndl steht für qualitativ hochwertige Dirndl und Trachtenmode seit über 50 Jahren. In unserem Online Shop finden Sie eine große und vielfältige Auswahl an eleganten und außergewöhnlichen Dirndl, Lederhosen und Accessoires.",+49715393880,http://krueger-dirndl.de,kontakt@krueger-dirndl.de,Krüger Dirndl GmbH Antoniusstr. 21 73249 Wernau Neckar Deutschland
https://www.trustedshops.de/bewertung/info_X6F9962A71D9DD15C7CE1A4A0C4036A6F.html,ideeundspiel.com - Online-Marktplatz,"In der fantastischen Welt voller beeindruckender Spielzeuge ist für jeden etwas dabei. Egal ob groß oder klein - die Fachgeschäfte von idee+spiel bieten ein umfangreiches Sortiment: Von der Babyschaukel bis hin zum Highspeed-Badminton-Set - auf dem idee+spiel Online-Marktplatz werden Sie sicher fündig. Mit diesen Spielsachen ist Spaß für die ganze Familie vorprogrammiert! Beim Spielen lernen Kinder bekanntlich fürs Leben. Mit Modelleisenbahnprodukten und speziellen Modellbauobjekten hat sicher nicht nur Ihr Sprössling großes Vergnügen. Beim Aufbauen solch einer Spiellandschaft mit kleinen, detailgenauen Bahnhöfen, Baustellen, Gebäuden, PKWs und vielem mehr verwandeln sich auch Erwachsene schnell mal wieder zu Kindern. Fingerfertigkeit, Geduld und Kreativität ist hier gefragt und wird trainiert. Bei den zugehörigen Fachhändlern von idee+spiel finden Sie auch im Bereich Fahrzeugmodelle eine große Auswahl. Mit Kindern zusammen zu sein, ist Balsam für die Seele. Nicht nur beim altbewährten Modellbau können Sie Ihrem Kind Gesellschaft leisten, ebenso beim Spielen mit Multimediaprodukten. Die Marken der verschiedenen Spielwaren, Modelleisenbahnen, Modellbau- und Multimediaprodukten sowie Games erstrecken sich von A bis Z. Hierunter zählen beispielsweise Barbie, Lego City, Monopoly, Nickelodeon, Playmobil und XTREM - berühmte Marken mit ausgezeichnetem Ruf, erstklassigen Waren und daher unschätzbarem Wert für eine glückliche Kindheit.",+495121511111,http://www.ideeundspiel.com,service@ideeundspiel.com,idee+spiel Betriebs-GmbH Daimlerring 4 31135 Hildesheim Deutschland
https://www.trustedshops.de/bewertung/info_X0F9CCDA0A62B05EAC3B4866C3E1221B8.html,kik.de,"Die KiK Textilien und Non-Food GmbH bietet günstige Mode für Damen, Herren und Kinder aber auch Heimtextilien und weitere Non-Food-Artikel. Der Textildiscounter hat günstige Basicartikel im Angebot und gewährleistet ganzjährig eine große Auswahl an Textilien. Die KiK Textilien und Non-Food GmbH arbeitet nach den Discounterprinzipien und gewährleistet so dauerhaft günstige Mode und mehr.",Telefonas nerastas,http://www.kik.de,kundenservice@kik.de,KiK Textilien und Non-Food GmbH Siemensstraße 21 59199 Bönen Deutschland
https://www.trustedshops.de/bewertung/info_X1B48BA5B3C585670A17A1FD6B4DF96C4.html,schoener-leben-shop.de,"Stoffe, Gardinen, Dekoration, Wohnaccessoires, Wohntextilien, Kreativität und Geschenke: im Schöner Leben-Shop finden sie alles, was das Leben schöner macht: Stoffe, Gardinen, Wohntextilien, Geschenke und Wohnaccessoires.",+499544950585,http://www.schoener-leben-shop.de,info@schoener-leben-shop.de,Michael Saffouri Bahnhofstr. 10 96148 Baunach Deutschland
https://www.trustedshops.de/bewertung/info_XD5B238D983E289376229358B76E45D6D.html,spiegelburg-shop.de,"Der Coppenrath & Die Spiegelburg Onlineshop: Alles von Prinzessin Lillifee, Capt'n Sharky, den Pferdefreunden, Baby-Glück, Spiegelburg Garden und weiteren beliebten Marken. Hochwertige Geschenkideen wie Spielzeug, Kinderkleidung, Schulbedarf, Baby-Alben, Bilderbücher, Schreibwaren sowie Schönes für Haus und Garten.",+4925142213,http://spiegelburg-shop.de,info@spiegelburg-shop.de,Coppenrath Online GmbH Hafenweg 30 48155 Münster Deutschland
https://www.trustedshops.de/bewertung/info_X34B31DE527DCE8B972FB11FE706DBB09.html,Pyroland.de,Im Feuerwerk-Shop Pyroland.de können Sie ganzjährig und zu Silvester Feuerwerk und Pyrotechnik sowie Partyartikel bequem online bestellen und kaufen.,+4942669555811,http://www.pyroland.de,info@pyroland.de,Bothmer-Pyrotechnik GmbH Zum Kleinen Loh 1 27383 Westervesede Deutschland
https://www.trustedshops.de/bewertung/info_X0F4D72C94270B3922A702B96F93F64F2.html,deiters.de,Deiters ist der Karnevals- & Faschingsexperte! Einzigartige Kostüme ✓ Riesige Auswahl ✓ Schnelle Lieferzeit ✓ Jetzt online bei Deiters kaufen.,Telefonas nerastas,http://www.deiters.de,onlineshop@deiters.de,Deiters GmbH Dr.-Gottfried-Cremer-Allee 5 50226 Frechen Deutschland
https://www.trustedshops.de/bewertung/info_XEAE52CFC9B2AA89CD26EC1711EF04694.html,partydeko.de,"Partydeko für Mottopartys, Geburtstage & Kinder-geburtstage günstig kaufen im großen Shop für Partydekorationen. PartyDeko.de bietet Ihnen eine große Auswahl an Partybedarf aller Art.",+492165376699,http://www.partydeko.de,info@partydeko.de,falksson GmbH Kölner Str. 69-73 41363 Jüchen Deutschland
https://www.trustedshops.de/bewertung/info_X25DFD0B27B1D09BC25D5A947F1BDB003.html,stoff4you.de,"Bei stoff4you.de erhalten Sie eine große Auswahl an Stoffen und Textilien als Meterware für fast jeden Verwendungszweck und aus allen Bereichen - und das zu echt günstigen Preisen: Dekostoffe, Bekleidungsstoffe, Möbelstoffe, Blackoutstoffe, Segeltuch, Satin, Tüll, Pannesamt, u.v.m.",+499001556670,http://www.stoff4you.de,service@stoff4you.de,Stoff Palette GmbH Hans-Hofmann-Str. 11 95213 Münchberg Deutschland
https://www.trustedshops.de/bewertung/info_X4B514076042798D95EFBBED96B3ED303.html,Theatermakeup.de,Theatermakeup.de ist der Spezial Shop für Film- und Theatermakeup - von Beauty bis zum Spezialeffekt. Zusätzlich bekommen Sie im Airbrushcenter Artikel für professionelles Arbeiten mit der Airbrushtechnik.,+493044041001,http://www.theatermakeup.de,info@theatermakeup.de,"Senjo Color GmbH Lübarser Str. 40-46, Haus 4 13435 Berlin Deutschland"
https://www.trustedshops.de/bewertung/info_XC8D32C0F1D52BC5F15FBE160C82528B0.html,Stoffbox-Naber.de,"Unser Stoffonlineshop bietet eine umfassende Auswahl an hochwertigen Stoffen zu günstigen Preisen für alle Ihre DIY-Projekte. Unsere Stoffpalette umfasst vielseitige Materialien wie elegante Seide, robusten Denim, bequemen Jersey und funktionalen Outdoor-Stoff, perfekt für DIY-Kleidung, Heimtextilien und Dekorationen. Unsere attraktiven Preise resultieren aus einem besonderen Konzept: Viele unserer Stoffe stammen aus Überproduktionen unserer Bekleidungsproduktionen. Diese effiziente Nutzung von Ressourcen erlaubt es uns, hochwertige Stoffe zu einem Bruchteil des üblichen Preises anzubieten. So profitieren Sie von exzellenter Qualität zu günstigen Konditionen.Entdecken Sie unsere saisonalen Kollektionen, die aktuelle Trends und klassische Designs vereinen. Unsere benutzerfreundliche Website ermöglicht eine einfache Navigation durch verschiedene Kategorien, Farben und Materialien, sodass Sie schnell das Passende für Ihr nächstes Projekt finden. Neben der Stoffvielfalt bieten wir auch zahlreiche Anleitungen und Tipps für DIY-Projekte. Egal, ob Sie Anfänger oder erfahren im Nähen sind, unsere Ressourcen helfen Ihnen, Ihre Fähigkeiten zu erweitern und neue Techniken zu erlernen. Besuchen Sie uns und erleben Sie die Welt der Stoffe, wo Qualität auf günstige Preise trifft und jede DIY-Idee Wirklichkeit werden kann. Mit unseren Stoffen aus Überproduktionen investieren Sie nicht nur in Ihre Kreativität, sondern auch in eine nachhaltigere Zukunft.",+499134991701,http://stoffbox-naber.de,stoffbox@nabermoden.de,Naber Produktion GmbH & Co. KG Industriestraße 2 91077 Neunkirchen am Brand Deutschland
https://www.trustedshops.de/bewertung/info_X1672EF3D0353E954FB1689B00A57442F.html,gongoll-shop.de,"Gongoll ist Ihr Partner für Spielwaren, Gartenmöbel, Grills, Sonnenschirme, Camping und Sportgeräte. Im Online-Shop finden Sie ein großes Camping-Sortiment, eine umfangreiches Grill- und Gartenmöbel-Angebot, Spielwaren und Freizeit-Artikel Seit über 50 Jahren führt Gongoll Neuheiten und Angebote vieler bekannter Marken und Hersteller. Das Geschäft liegt verkehrsgünstig an der A57 zwischen Köln und Neuss. Kostenlose Parkplätze sind am Geschäft vorhanden.",+49213326040,http://www.gongoll-shop.de,info@gongoll-shop.de,Tramp & Camp Sportartikel Handelsgesellschaft mbH Bergiusstr. 6 41540 Dormagen Deutschland
https://www.trustedshops.de/bewertung/info_XF07F51195C3094166911B7A8C22BFADE.html,Hen & Stag,"Stylishe JGA Outfits, lustige Gimmicks und tolle Überraschungen für das Brautpaar: in Hen & Stag's Trauzeugen-Shop findest du einfach alles, was du für deine Mission als Trauzeugin oder Trauzeuge brauchst! Entdecke über 500 coole Outfits und Accessoires für den Junggesellenabschied. Stylishe JGA Shirts, Turnbeutel, Sonnenbrillen, Hüte und viele weitere tolle Accessoires, die eure Braut und euren Bräutigam begeistern werden. Und das Beste daran: nicht nur all die tollen Sachen, auch das Team von Hen & Stag wird euch begeistern: #Toller Service: bei Hen & Stag bekommst du innerhalb von 24 Stunden eine persönliche Antwort. Keine Textbausteine. #Schneller Versand: Hen & Stag versendet deine Bestellung entweder am gleichen oder spätestens am nächsten Werktag nach Zahlungseingang. Schaut jetzt vorbei und sichert euch rechtzeitig eure JGA Outfits! www.hen-party-shop.de",+4982165083991,http://www.hen-party-shop.de,service@hen-party-shop.de,Parma Sassone GbR Hochzoller Str. 19b 86163 Augsburg Deutschland
https://www.trustedshops.de/bewertung/info_XF2F1CC9D574BEAEE0E7527502435122F.html,alpenclassics.de,"Wir bieten unseren Kunden eine vielfältige Auswahl an Trachtenmode für Damen, Herren und Kinder. Unser Online-Shop führt alles von traditionellen Dirndln und Lederhosen bis hin zu modernen, extravaganten Designer-Trachten. Wir führen Modelle für jeden Anlass, sei es Oktoberfest, Hochzeit oder Alltag, in verschiedenen Preisklassen. Hochwertige Accessoires und Trachtenschuhe runden das Angebot ab. Entdecken Sie jetzt Ihre Lieblingstracht bei Alpenclassics!",+4929417463040,http://www.alpenclassics.de,service@alpenclassics.de,"Alpenclassics e.K. An der Gärtnerei, 12 59555 Lippstadt Deutschland"
https://www.trustedshops.de/bewertung/info_X89F352386C501396D374AB4557C330B9.html,NICO Feuerwerksshop,"Entdecken Sie das umfangreiche Sortiment an Feuerwerks- und Partyartikeln der NICO. Stellen Sie Ihre eigene Feuerwerksshow zusammen. Nur einmal zünden und eine komplette Show genießen. Zusätzlich wir ein umfangreiches Sortiment an Partyartikeln, wie Fackeln, Knicklichter und Konfetti Shootern angeboten.",+49307200800,http://www.nico-europe.com,k.seeger@nico-europe.com,NICO Europe GmbH Rigistr. 8 12277 Berlin Deutschland
https://www.trustedshops.de/bewertung/info_XF10C0DEA64D7BAD44043C6E75FE7A813.html,Budgetstoffe.de,"Bei Budgetstoffe.de lieben wir Stoffen und besonders die Stoffen die wir billig anbieten könnten! Wir haben ein sehr einzigartig und Farbenreich Assortiment, mit konstant neuen Angeboten! Daneben verkaufen wir auch Stoffen aus unserem Standardsortiment. Diese einzigartige Stoffen sind immer aus unserem Vorrat Lieferbar und verfügbar in verschiedene Farben. Und das tolle ist….. Unsere Stoffen aus unsere eigene Kollektion sind verfügbar ab 1.50 Euro pro Meter! Machen Sie etwas Schönes davon! Von Modestoffen bis Theaterstoffen, Dekorationsstoffen, Möbelstoffen, Kinderstoffen, Karnevalstoffen , usw. Unsere Stoffen werden wirklich überall für benutzt und jeder macht mit unseren Stoffen seine schöne eigene Kreation! Wir lieben verschiedene Farben, Kreative Exzesse und handgefertigte Produkten, die sorgfältig und mit liebe sind gemacht. Eine gute Kundendienst steht bei uns immer auf Nummer 1! Wir finden eine gemütliche und persönliche Kundendienst immer sehr wichtig. Wenn Sie Fragen haben oder uns gerne um Beraten fragen möchte, nehmen Sie bitte Kontakt mit uns auf. Wir helfen Ihnen gern und finden es sehr angenehm als Sie gut informiert werden bevor Sie einen Ankauf machen. Nichts ist für uns wichtiger dann einen fröhlicher und zufriedener Kunde! Unsere Stoffen-Bude Daneben heißen wir Ihnen herzlich Willkommen bei unserer Stoffen-Bude! Wir stehen auf die Wochenmarkt in Rotterdam und sie können uns auch besüchen auf verschiedene Stoffen-Spektakel",+31341276898,http://www.budgetstoffe.de,contact@budgetstoffen.nl,Budgetstoffen.nl Morsestraat 10 3846CW Harderwijk Niederlande
https://www.trustedshops.de/bewertung/info_X8D46E67DA02D7B80BB0EC82D5AB379BD.html,spielwaren-hegmann.de,"Spielwaren-hegmann.de ist Ihr kompetenter Ansprechpartner in Großheubach und Miltenberg zum Thema Spielzeug, Spielwaren, Lego, Modelleisenbahn, Modellbau usw.",+4993716508017,http://www.spielwaren-hegmann.de,info@spielwaren-hegmann.de,"Berta Hegmann, Inhaberin Marietta Brand e.Kfr. Industriestr. 1 63920 Großheubach Deutschland"
https://www.trustedshops.de/bewertung/info_X11F72B196F9795956ED6CAEFED3222E0.html,holzspielerei.com,"Entdecken Sie hochwertiges Holzspielzeug mit historischem Bezug. Holzschwerter, sowie Kinderbögen lassen Kinderherzen höher schlagen.",+4985641400,http://www.holzspielerei.com,info@holzspielerei.com,Holzspielerei Baumgartner GmbH Untere Hauptstraße 17 - 19 84381 Johanniskirchen Deutschland
https://www.trustedshops.de/bewertung/info_X882F706601B45E8A4AABBCA36B0A53BF.html,tortenbild-druckerei.de,Aprašymas nerastas,+4936458482382,http://tortenbild-druckerei.de,robert@tortenbild-druckerei.de,Robert Riethmüller Weimarische Straße 20 99438 Bad Berka Deutschland
https://www.trustedshops.de/bewertung/info_X50538DA1357E08E01F69FE4B7359EB89.html,hairoyal.de,Groß- und Einzelhändler für Hairextensions - seit 2004 - hairoyal.de bietet Ihnen eine große Auswahl für professionelle Einarbeitung von Echthaarverlängerungen an.,+493518106212,http://www.hairoyal.de,info@hairoyal.de,Diana Berthold Schlesischer Platz 2 01097 Dresden Deutschland
https://www.trustedshops.de/bewertung/info_XC6C6B2F3692F56E3896A9D0FE7FFD6FF.html,kostuempalast.de,"Gruselige Halloween Kostüme, lustige Karnevalskostüme, tolle Deko Artikel und Fasching Accessoires finden Sie im Online Shop von Kostümpalast. Der Shop führt eine riesige Auswahl an Kostümen für Babys, Kleinkinder, Teenager, Damen und Herren. Egal ob sexy, glamourös, furchteinflößend oder witzig – wenn es um die richtigen Kostüme für Fasching, Halloween oder Mottoparty Kostüme geht, ist Kostümpalast Ihr Ansprechpartner Nummer 1!",+4971417024472,http://kostuempalast.de,info@kostuempalast.de,Kostümpalast GmbH Max-Eyth-Str. 1 71691 Freiberg Deutschland
https://www.trustedshops.de/bewertung/info_XF2EFAFA8A32B91F04D210D6B473AD0BF.html,coolstuff.de,"Bei Coolstuff.de finden Sie jede Menge lustige und ausgefallene Geschenke. Verwenden Sie einfach den schlauen Geschenkgenerator, der hat immer die passenden Ideen sofort parat. Einfach Geschlecht, Alter und Preis einstellen und der Generator sucht nach Ihren Vorgaben Geschenke und gibt eine große Auswahl an Geschenkideen.",+493089360694,http://www.coolstuff.de,service@coolstuff.de,CoolStuff AB Goethestr. 85 10623 Berlin Deutschland
https://www.trustedshops.de/bewertung/info_XA23E1669A31DD5F30E40191588D72A25.html,Party.de,"Mit unserem Online-Shop Party.de erobern wir die Partywelt. Ob Kindergeburtstage, Halloweenparty, Weihnachtsfeiern oder andere Feste, wir haben für jeden Anlass die passende Dekoration im Shop! Zahlreiche nationale und internationale Lieferanten tragen zu einem großen und abwechslungsreichen Sortiment bei! Doch wie man uns kennt, ist ein Land nicht genug. Mit unseren internationalen Partyshops peppen wir auch Partys außerhalb Deutschlands mit unserer schönsten Partydeko auf. Mittlerweile sind wir auch in Frankreich, in Italien, in den Niederlanden, in der Schweiz und in Belgien unterwegs und nehmen Kurs auf weitere Länder in der ganzen Welt.",Telefonas nerastas,http://www.party.de,El. paštas nerastas,We Love Parties GmbH Elso-Klöver-Str. 9a 21337 Lüneburg Deutschland
https://www.trustedshops.de/bewertung/info_X121D5BBC4E45D0EB4FBD5ACD9893FCBE.html,Partywinkel.de,"Partywinkel.de ist der Online-Partyshop für Ihren gesamten Partybedarf und Ihre Dekoration. Hier finden Sie den perfekten Partybedarf für jede Party, von Geburtstagen bis hin zu Hochzeiten und allem dazwischen. Warum Sie Ihre gesamte Dekoration gleich bei Partywinkel.de bestellen sollten: Mega-Sortiment: Partywinkel.de bietet eine riesige Auswahl an Partybedarf, darunter Luftballons, Tischdekoration, Kostüme, Party-Sets, Heliumflaschen und vieles mehr. Es ist für jeden etwas dabei, egal ob Sie eine Mottoparty organisieren oder nur allgemeinen Partybedarf benötigen. Hohe Qualität: Die Partyartikel bei Partywinkel.de sind von hoher Qualität und lassen Ihre Party großartig aussehen. Zum Beispiel bleiben die Luftballons lange aufgeblasen und die Kostüme sind von guter Qualität und angenehm zu tragen. Schneller Versand: Bestellungen, die vor 16:00 Uhr eingehen, werden noch am selben Werktag verschickt und Sie erhalten sie innerhalb von 2 bis 3 Werktagen. Erschwinglich: Partywinkel.de bietet auch marktübliche Preise für seine Partyartikel an, was sehr gut ist, wenn Sie eine Party mit einem begrenzten Budget veranstalten. Toller Kundenservice: Partywinkel.de hat auch ein tolles Kundenservice-Team, das Ihnen bei allen Fragen oder Problemen helfen kann. Kurz gesagt, Partywinkel.de ist der Online-Partyshop für alle Ihre Partyartikel mit einer großen Auswahl. Wenn Sie eine Party planen, sind Sie bei Partywinkel.de an der richtigen Adresse.",Telefonas nerastas,http://www.partywinkel.de,kundendienst@partywinkel.de,Partywinkel B.V. Luzernestraat 83 J 2153 GM Nieuw-Vennep Niederlande
https://www.trustedshops.de/bewertung/info_XADB4545A2101779A3115A83941DD626F.html,BOUDOIR NOIR,"""Böse Mode, die anzieht."" ein Versprechen, das Boudoir Noir seit 2014 seiner Kundschaft über viele Genre-Grenzen hinweg macht. Ausgefallene Damen und Herren-Mode von Gothic über Steampunk bis hin zu Burlesque wird bei Boudoir Noir mit viel Liebe zum Detail bei namhaften Szene-Herstellern, wie Punk Rave, Devil Fashion, Killstar oder Dark In Love ausgesucht und im ansprechenden und service-orientierten Webshop Käuferinnen und Käufern weltweit präsentiert und angeboten. Abgerundet wird das umfangreiche Angebot aus sofort zum Versand verfügbaren Artikeln durch fantasievolle Accessoires und Gothic-Lifestyle-Artikeln. Der Böse Mode Blog stellt zudem regelmäßig Interessantes und Wissenswertes aus dem düsteren Modeuniversum von Boudoir Noir vor. Wie das im Französischen als ""Boudoir"" bezeichnete vornehme Ankleidezimmer aus vergangenen Tagen, verspricht das düstere Boudoir Noir von heute seine Kundinnen und Kunden mit dieser sinnlichen und intimen Atmosphäre voller Ästhetik und Eleganz, in eine fantasievolle Welt dunkler Versuchungen zu entführen.",+4971634058944,http://www.boudoir-noir.de,info@boudoir-noir.de,BOUDOIR NOIR Inh. Caroline Stahl Gentenriedweg 10 73061 Ebersbach an der Fils Deutschland
https://www.trustedshops.de/bewertung/info_X705825DD415E080CC4C60B02528E731B.html,kreativ-store24.de,"Sie sind auf der Suche nach Schminke und Farben für Facepainting, Airbrush Tattoos oder Glitzertattoos? Dann sind Sie hier im kreativ-store24.de genau an der richtigen Adresse: In unserem umfangreichen Onlineshop bieten wir Ihnen eine große Auswahl an Schminkprodukten, Airbrushbedarf und Künstlerbedarf. Wichtig in Sachen Schminke und Farben sind dabei vor allem die Hautverträglichkeit sowie die leichte Handhabung der Produkte. Wir bieten Ihnen ausschließlich Markenware an, von deren Qualität wir selbst überzeugt sind. Die Vielfalt der Produktauswahl ist enorm: Klicken Sie beispielsweise auf die Rubrik Schminkfarben und Zubehör, wenn Sie auf der Suche nach Artikeln in den Bereichen Schminken und Farben sind. Hier erwartet Sie eine fantasievolle Produktvielfalt – angefangen bei Schminkfarben für Profis, beispielsweise von Diamond FX, über Schminkzubehör wie Pinsel oder Schwämmen bis hin zu Schminkbüchern und Temptu Airbrush Makeup. Außerdem sehr beliebt: Tattoo-Schablonen – auch erhältlich in der Variante als Glitzer-Tattoo-Schablone – und Farben für temporäre Tattoos wie vom Profi. In einem bestens ausgestatteten Kreativ-Store darf eine entsprechende Auswahl an hochwertigen Künstlermaterialien natürlich nicht fehlen. Von Schmincke Aquarellfarben über Faber-Castell Polychromos Künstlerfarbstifte bis hin zu Staffeleien und Zeichenblöcken führen wir alles, was das Künstlerherz begehrt. Jetzt shoppen und der Kreativität freien Lauf lassen.",+49613240504,http://kreativ-store24.de,mail@kreativ-store.de,Jörg Tronser Friedrichstraße 11 55218 Ingelheim Deutschland
https://www.trustedshops.de/bewertung/info_X53D06E2C8DCC3BF5118890D1058B55AC.html,goldberg-stoffe.de,"Herzlich willkommen bei Ihrem Groß- und Einzelhandel für Stoffe und Kurzwaren seit mehr als 60 Jahren. Online in unserem Shop oder auf ca. 600 m² bieten wir Ihnen eine große Auswahl an Stoffen, Kurzwaren und Schnittmustern. Finden Sie einen gesuchten Artikel weder online noch in unserem Geschäft?! Dann sprechen Sie uns an. Wir machen uns gerne auf die Suche für Sie. Wir beraten Sie mit ❤ und Verstand. Ihr Goldberg Team",+49602124422,http://goldberg-stoffe.de,info@goldbergkg.de,Goldberg KG Mainaschaffer Straße 109 63741 Aschaffenburg Deutschland
https://www.trustedshops.de/bewertung/info_XFC673D70E664403ABBC9A293B5CB494E.html,www.herberttextil.de,"Herbert Textil – Ihr Experte für Kurzwaren und Stoffe! Entdecken Sie eine Welt voller Kreativität und Qualität bei Herbert Textil. Seit über 25 Jahren sind wir führender Anbieter von Kurzwaren und Stoffen und bieten Ihnen ein breites Sortiment an Produkten, die Ihre kreativen Projekte zum Leben erwecken. Egal, ob Sie nach wunderschönen Bündchen, elastischen Jerseys, praktischen Reißverschlüssen oder zarten Spitzenbändern suchen – bei uns werden Sie fündig.",Telefonas nerastas,http://www.herberttextil.de,info@herberttextil.de,"Jan Hendrik Huibert Kruiskamp Bocholder Esch, 27 48683 Ahaus Deutschland"
