URL,Pavadinimas,Aprašymas,Telefonas,Svetainė,El. paštas,Adresas
https://www.trustedshops.de/bewertung/info_XCEB9A993D4C9C70806BCFBEFF0C6AC61.html,satinee.eu,"Entdecken sie diese Strumpfideen und die Vielfalt bei Strümpfen, Socken, Strumpfhosen Leggings Halterlose Strümpfe. satinee.eu führt in seinem Online Shop und in seinen 7 Filialen in Hessen 6 Nordbayern seit über 50 Jahre Markenstrümpfe aller bedeutsamen Marken. Von BOSS über Burlington, ELBEO, FALKE, HUE, HUDSON, KUNERT, ITEM 6 , Tommy Hilfiger, Wigglesteps, bis zu Wolford um nur die wichtigsten zu nennen ! Größe Füße lange Beine satinee.eu hat die Lösungen für Sie. z.b. Herren Socken bis Schuhgröße 58 mit Passformgarantie ! Strumpfhosen, halterlose Strümpfe und Straps Strümpfe bis Konfektionsgröße 62 hier erhältlich. Viele Spezialitäten wie Sie sich für ein kompetentes Fachgeschäft gehört.",+49661941610,http://www.satinee.eu,shop@satinee.de,Ehlers Handels GmbH & Co. KG Doktor Weinzierl Str. 1 36043 Fulda Deutschland
https://www.trustedshops.de/bewertung/info_XC74C6B9654CF3DF577A8DCAF170B15DD.html,Disfrazzes.de,"Disfrazzes ist ein Geschäft mit mehr als 15 Jahren Erfahrung im Bereich Kostüme, Accessoires und Dekoration. Bei Disfrazzes finden Sie mehr als 11000 verschiedene Kostüme, originell, in allen Größen und für die ganze Familie. Alles, was Sie für ein perfektes Karnevalskostüm brauchen, um vor Angst zu sterben mit Halloween-Kostümen oder um das perfekte Bild mit Ihrem Weihnachtskostüm zu bekommen, finden Sie bei Disfrazzes.com. Vervielfachen Sie den Spaß mit Kostümen und Accessoires!",Telefonas nerastas,http://www.disfrazzes.de,kontakt@disfrazzes.de,"GARCIA FIESTAS, S.L. Calle Valladolid, 5 03440 Ibi (Alicante) Spanien"
https://www.trustedshops.de/bewertung/info_X52996CC2FB46385661431489D2D6F850.html,"TextileClub.de - Stoffe, Nähzubehör zu besten Preisen!","TextileClub.de: Stoffe, die begeistern! Entdecke jetzt unsere riesige Auswahl an hochwertigen Stoffen und Nähzubehör. Meterware, Zubehör & faire Preise. Besuche www.textileclub.de und Bestelle noch heute!",+4915210377724,https://textileclub.de/,info@textileclub.de,TextileClub GmbH Kleine Friedensstraβe 24 15328 Küstriner Vorland Polen
https://www.trustedshops.de/bewertung/info_XF531A458A838372B7DEF8EA8BE3840C5.html,TrachtenHeimat.de,"Der Online-Shop Trachtenheimat.de ist Ihr besonderer Shop für stylische Dirndl, edle Trachten und Lederhosen. Hier finden Sie eine große Auswahl an unterschiedlicher Trachtenbekleidung.",+4994219633855,http://trachtenheimat.de,info@trachtenheimat.de,Doris Kornherr Ludwigsplatz 33 94315 Straubing Deutschland
https://www.trustedshops.de/bewertung/info_XC21989BEA8D847DAB92CA8FD544A5AFC.html,Spielzeug-Online-Shop für Preisbewusste mit Gratis-Artikel ab 20Euro-Einkauf.,"Entdecken sie unser großes Sortiment und sichern Sie sich ab 20,- Warenwert einen Gratisartikel. Sie finden bei uns Top-Angebote aus Neuware und 2.Wahl-Artikel. 2.Wahl-Artikel sind neu und unbespielt, mit beschädigter Verpackung.",+49238276682199,http://www.rappelkiste-spielwaren.com,rappelkiste.ahlen@online.de,Rappelkiste Markus Schier e.K. Gersteinstraße 2-4 59227 Ahlen Deutschland
https://www.trustedshops.de/bewertung/info_XE58B98216FBC6A0111BA467570E95142.html,flaggenfritze.de,Aprašymas nerastas,+492334585438,http://www.flaggenfritze.de,info@flaggenfritze.de,mochrefie.com GmbH Spannstiftstrasse 39 58119 Hagen Deutschland
https://www.trustedshops.de/bewertung/info_XD4A289649D5CC12285F9442B081860D0.html,vegaoo.de,"Vegaoo.de ist einer der größten Kostüm- und Partyartikel-Onlineshops Europas! Sie finden bei vegaoo.de immer die größte Auswahl von Erwachsenen- und Kinderkostümen zum Besten Preis. vegaoo.de versichert, dass alle Produkte auf der Webseite immer auf Lager und versandbereit sind. Um Ihre Ausstattung zu vervollständigen, finden Sie im Angebot von vegaoo.de ebenfalls Zubehör und Schminke, sowie Perücken und Dekoration, um einen gelungenen Abend zu gestalten. Ob Sie einen Themenabend oder eine andere festliche Veranstaltung planen, bei vegaoo.de finden Sie Alles wovon Sie träumen, um Ihre Freunde und Familie zu verblüffen.",+496917297019,http://www.vegaoo.de/,kundenservice@vegaoo.com,JADEO FRANCE SASU 1 Bis Rue le Chatelier 38090 Vaulx-Milieu Frankreich
https://www.trustedshops.de/bewertung/info_X137169713345BFDBA4FFBC6E57B3BFDC.html,Karneval Megastore,"Ob Hippie der 68-er Jahre, gruseliger Graf Dracula, stattlicher Ritter, Zorro, King Kong oder Hexe, im Karneval Megastore finden Sie das passende Kostüm. Bei der großen Auswahl Karnevalskostüme ist wirklich für jeden was dabei und die Bestellung im Karnevalshop ist übersichtlich und schnell. Sei es das Prinzessinen Karnevalskostüm für die kleinen oder die Klassiker wie Pirat und Cowboy, beim Karneval-Megastore werden Sie mit Sicherheit fündig!",+49715381838882,http://www.karneval-megastore.de,support@karneval-megastore.de,Jadeo Germany GmbH Antoniusstraße 18 73249 Wernau Deutschland
https://www.trustedshops.de/bewertung/hutbestellen-de,HutBestellen.de,"HutBestellen.de bietet Ihnen ein sehr großes Sortiment an Mayser Hüten, der Traditionsmarke aus Deutschland. Dieser Web Shop führt dazu die Frühjahrs-Sommerkollektion und die Herbst-Winterkollektion, so dass Sie immer den passenden Mayser Hut finden. Im Sommer besonders beliebt ist der Mayser Menowin Stoffhut, der Mayser Calas Strohhut, Mayser Menton Strohhut und die Mayser Riccardo Mütze. Im Winter sind die Mayser Udo Filzhüte, die Mayser Taxi Filzmütze und der Mayser Georgia Filzhut die Bestseller. Zudem werden modische Michael Zechbauer Hüte und Mützen angeboten welche zur Firma Mayser gehören. Das ganze Sortiment liefert HutBestellen versandkostenfrei für Sie! Trachtenhüte dürfen auf keinem Volksfest und traditionellen Veranstaltung fehlen. Bei HutBestellen finden Sie ein großes Sortiment vielen Farben, wie Trachtenhüte in rot, schwarz, grün, braun, grau und fuchsia. Sollten Sie Beratung benötigen, steht Ihnen die Telefon und Email Fachberatung gerne zur Verfügung. Das ganze Sortiment liefert HutBestellen versandkostenfrei für Sie! Trachtenhüte dürfen auf keinem Volksfest und traditionellen Veranstaltung fehlen. Bei HutBestellen finden Sie ein großes Sortiment vielen Farben, wie Trachtenhüte in rot, schwarz, grün, braun, grau und fuchsia. Sollten Sie Beratung benötigen steht Ihnen die Telefon und Email Fachberatung gerne zur Verfügung.",+49991342736,http://www.hutbestellen.de,El. paštas nerastas,Firm Stefan Jelinek Metzgergasse 3 94469 Deggendorf Deutschland
https://www.trustedshops.de/bewertung/liamoria-de,Liamoria - Manufaktur für individuelle Kerzen und Geschenke,Entdecke mit uns die Welt der individuellen Kerzen und Geschenke. Liamoria steht für Handmade in Germany und höchste Qualität. Unsere Kerzen egal ob Hochzeitskerzen oder Taufkerzen sowie aber auch für alle anderen Anlässe lassen wir durch die Gütegemeinschaft RAL sowie DEKRA unsere Kerzen zertifizieren und bieten so unseren Kunden ein hohes Maß an Transparenz und Sicherheit.,+4954724069967,http://www.liamoria.de,service@liamoria.de,Eckernkamp 21 49152 Bad Essen Deutschland
https://www.trustedshops.de/bewertung/info_X807CDDE97059BDC06A6F1FF33A69AB35.html,oblique-unique.com,"Entdecken Sie in diesem Shop alles für stylische Mottopartys und saisonale Anlässe Partydeko, Junggesellinnenabschied, Hochzeit, Babyshower & Geburtstage. JGA/Hochzeit: Allerlei Zubehör für den perfekten Junggesellinnenabschied sowie für die wunderschöne Hochzeit zeichnet Oblique-Unique aus. Elegante Hochzeitsartikel aber auch lustige Scherzartikel, knallige Accessoires wie Schärpen, Schleifen oder bedruckte Buttons findet Frau oder Mann in diesem Shop. Babyshower Partys sind voll im Trend. Viele süße und bezaubernde Artikel machen dabei die Vorfreude auf das Baby noch größer. Werdende Mamas strahlen wenn sie den Raum betreten, der in Blau oder Rosa geschmückt ist. Ob Tischkonfetti mit Kinderwagen und Nukelflasche, Girlanden, Schnuller oder Fotorequisiten, der Shop bietet eine riesige Auswahl. Partydeko spielt auf jeder Feier neben den richtigen Gästen, guter Laune und tollen Speisen und Getränken eine entscheidende Rolle. Auf Oblique-Unique findet man garantiert alles für Groß und Klein, was für eine einmalige und unvergessliche Party benötigt wird. Angefangen bei diversen Luftballons, Girlanden, Konfetti und Lametta bis hin zu schöner Holzdeko, Wandtattoos oder passende Trinkhalme und vielem mehr. Fasching/Karneval/Halloween: Ein riesige Auswahl an Accessoires für Kinder und Erwachsene verschaffen deinem Kostüm ein besonderes Highlight. Oblique-Unique - für ein bißchen mehr Spaß im Leben.",+4936375530956,http://www.oblique-unique.com,service@oblique-unique.de,Horsti GmbH Am Käsebach 10 99638 Kindelbrück Deutschland
https://www.trustedshops.de/bewertung/saberkingfx-com,SABER KING FX LIGHTSABERS®,"Willkommen bei SABER KING FX, deinem Nummer Eins Lichtschwerter-Shop in Deutschland und Europa, hier findest du High End Neopixel Lichtschwerter, Xenopixel Lichtschwerter, duellfähige RGB Lichtschwerter bis hin zu Master Repliken und legendäre Movie Lichtschwerter. SABER KING FX LIGHTSABERS® hat die Mission, das realistischste und authentischste Lichtschwert der ganzen Galaxie zu erschaffen. Es geht uns darum, die kompromisslose Lichtschwertperfektion zu erreichen, überzeuge dich selbst! MAY THE FORCE BE WITH YOU",Telefonas nerastas,http://saberkingfx.com,El. paštas nerastas,Am Kirchenbach 3B 66740 Saarlouis Deutschland
https://www.trustedshops.de/bewertung/info_X3C1014A5B20F07CC2B5A7B48E2F92D0E.html,Saberland.de,"Willkommen bei Saberland.de – deinem Zuhause für hochwertige Lichtschwerter! ✨ Seit 2021 haben wir uns auf die Mission gemacht, die Faszination für Lichtschwerter in die Hände von Fans, Sammlern und Cosplayern zu bringen. Unser Team, bestehend aus echten Enthusiasten (ja, wir leben und lieben die Galaxie weit, weit entfernt), hat ein Ziel: Dir das beste Lichtschwert-Erlebnis zu bieten, das du dir vorstellen kannst. Bei uns findest du alles – vom Einsteigermodell bis hin zu detailverliebten Repliken. Unsere Schwerter sind aus robustem Aluminium gefertigt, fühlen sich einfach genial in der Hand an und kommen mit beeindruckenden Features wie wechselbaren Farben und reaktiven Soundeffekten. Und das Beste: Kein Zollstress, keine langen Wartezeiten – wir verschicken direkt aus Deutschland! Wir wissen, dass so ein Lichtschwert mehr ist als nur ein Gadget – es ist ein Statement, eine Leidenschaft. Deshalb stehen wir dir mit persönlichem Service zur Seite, um sicherzugehen, dass du genau das bekommst, was du suchst. Schau dich um, finde dein Lichtschwert und mach dich bereit, die Macht in deinen Händen zu spüren. Dein galaktisches Abenteuer beginnt hier – bei Saberland.de! 🚀",+4915783502745,http://www.saberland.de,info@saberland.de,Saberland.de GmbH Robert Koch Straße 5 68723 Plankstadt Deutschland
https://www.trustedshops.de/bewertung/info_X5BB46A2254522D64CEB40D08ACB9C6D2.html,JAKO-O,"Willkommen bei JAKO-O – wir machen Kinder glücklich! Wir sind JAKO-O – ein fröhliches, buntes Familienunternehmen mit einer großen Mission: Kinder und Eltern mit hochwertiger, funktionaler und langlebiger Kindermode zu begeistern! Seit vielen Jahren stehen wir für durchdachte Kleidung, die perfekt auf die Bedürfnisse von kleinen und großen Abenteurer*innen abgestimmt ist – bequem, strapazierfähig und natürlich kunterbunt! Neuer Name, gewohnt gute Qualität! Seit September haben wir einen Neustart gewagt: JAKO-O gehört nun zur Connect GmbH. Was bleibt? Unsere Leidenschaft für starke Produkte, die Kinder glücklich machen – und natürlich die gewohnte JAKO-O Qualität, auf die ihr euch verlassen könnt! Ihr findet unsere fröhlich-bunte Mode online oder in ausgewählten Geschäften – immer mit viel Liebe für kleine Wirbelwinde gemacht. JAKO-O – von Eltern für Kinder gemacht. ❤️",+494264837800,https://www.jako-o.com/,info@jako-o.com,Connect GmbH Dorfstraße 13 27367 Hellwege Deutschland
https://www.trustedshops.de/bewertung/info_X079198F3BC11FA13F8980EB6879E2677.html,test-classic-migration.com 1 Änderung,"Das ist der Beschreibungstext... <a class=""mt-2 button primary mb-2 cta"" target=""_blank"" href=""https://www.trustedshops.de"">Button</a>",Telefonas nerastas,http://www.test-classic-migration.com,developer_de@trustedshops.de,TS Developer GmbH Demostrasse 1001 12345 Demostadtbezirk Deutschland
https://www.trustedshops.de/bewertung/info_X0756CE5F62964AD72182DFFB35613A44.html,liebeslust.de,Aprašymas nerastas,+49497402919188,http://www.liebeslust.de,kontakt@liebeslust.de,HOV GmbH Freudenstädter Str. 36 78655 Dunningen (Seedorf) Deutschland
https://www.trustedshops.de/bewertung/info_XAD9CE6B202486EEE73E5DFB28C865B17.html,das-kostuemland.de,"Im Online-Shop Das Kostümland erhalten Sie das tolle Kostüme für Ihre Karnevals- oder Faschingparty, sowie für Halloween oder Kindergeburtstage. Weiterhin bieten wir Ihnen eine große Auswahl an Partyartikeln und Luftballons.",+499188504684,http://www.das-kostuemland.de,info@das-kostuemland.de,May Party GmbH Kago-Platz 3c 92353 Postbauer-Heng Deutschland
https://www.trustedshops.de/bewertung/info_X8C6404878D2B6FD8D0C660E89EAF79CA.html,costumalia.com,"Mister Kostüm, Lieferungen in 24 Std. Die größte Auswahl an Kostümen für alle Themen und Partys: Karneval, Halloween, JGA, Mittelalter, Römer, Wikinger. Lasse Dich verzaubern und tauche in eine kunterbunte Welt voller Kreativität und Spaß ein. Verkleidungen fūr jede Altersgruppe",Telefonas nerastas,https://de.costumalia.com/,info@costumalia.de,Don Disfraz S.L.U. Carretera Ribadetea s/n km 1 36860 Ponteareas Spanien
https://www.trustedshops.de/bewertung/info_XC28D001D8C84607858B813491A5E6E17.html,magicoo.de,Aprašymas nerastas,+491622088507,http://www.magicoo.de,info@magicoo.de,Karolina Schaefer Amsterdamer Str. 230 50735 Köln Deutschland
https://www.trustedshops.de/bewertung/tabou-de,Tanzboutique Tabou,"Seit über 30 Jahren zuverlässiger und günstiger Partner für Bühne, Tanz, Show, Bauchtanz, Showtanz, Garde, Aerobic, Gymnastik und vieles mehr. Tanzboutique Tabou ist mit 30.000 Artikeln einer der größten und leistungsfähigsten Anbieter. Überzeugen Sie sich von unserem riesigen Angebot zu günstigsten Preisen. Unser Spezialgebiet ist jegliches Zubehör zur Gestaltung eines Tanzkostüms, zur kreativen Ausschmückung der Kostüme und Bekleidung aller Tanzrichtungen wie Gardetanz, Showtanz, Bauchtanz, Orientalischer Tanz, Belly Dance, Tribal, Karneval, Fasching usw. Daneben bieten wir ein umfangreiches Sortiment an Nähstoffen und -zubehör. Dazu gehören vor allem Stoffe und Accessoires wie z.B. Pailletten, Paillettenmotive, Paillettenbänder und -borten, Federn, Perlen, Stifte etc. Weiterhin führen wir Trainingsbekleidung wie Bodys, Catsuits, Schuhe und Strumpfhosen. Zusätzlich haben wir auch orientalische Bauchtanzbekleidung zu super günstigen Preisen in unserem Programm wie Hüfttücher, Röcke, Schleier, Hosen, Oberteile, Netzbodys, BHs, Gürtel, Isis-Wings und Münzartikel. Diese werden teilweise in Ägypten nach traditionellen Vorlagen in Handarbeit exclusiv für uns gefertigt. Herzlich willkommen in der Tanzboutique Tabou.",+49674289010,http://tabou.de,El. paštas nerastas,Tabou OHG Oberstraße 62 56154 Boppard Deutschland
https://www.trustedshops.de/bewertung/info_X0CD7E999CBD027327659802973DAF11F.html,kartenkuss.de,"Im Online-Shop von kartenkuss.de finden Sie besondere Einladungs-, Danksagungs- und Hochzeitskarten für die einmaligen Momente in Ihrem Leben. Hier finden Sie für jeden Anlass die passende Karte ob Hochzeit, Geburtstags, Taufe ...",+492861921763,http://www.kartenkuss.de,service@rehms24.de,Rehms 24.de GmbH Landwehr 52 46325 Borken Deutschland
https://www.trustedshops.de/bewertung/info_X03ED1B230CE09DF5783F4E3F69E4E9D9.html,party-einhorn.de,Party Einhorn bietet eine große Auswahl an Partyzubehör für Kindergeburtstage und Mottopartys. Lassen Sie sich inspirieren und entdecken Sie schöne Dekorationsartikel und alles für den Partytisch für Ihre Feier.,+4941549869866,http://www.party-einhorn.de,info@party-einhorn.de,"PARTY EINHORN, Inh. Susanne Dietrich e.K. Hinterm See 16 22946 Großensee Deutschland"
https://www.trustedshops.de/bewertung/info_X969F2F06DC084CC3FF57565FC7926F1C.html,karnevalswierts.com/de/,Aprašymas nerastas,+492236880800,http://www.karnevalswierts.com/de/,info@karnevalswierts.nl,Karnevalswierts Webshop B.V. Heliumstraat 10 6422 PK Heerlen Niederlande
https://www.trustedshops.de/bewertung/uwantisell-de,Uwantisell,Top angesagte Looks & Trends für jede Frau. Finde in deinem Young Fashion Shop den perfekten Style zu günstige Preisen | Schnelle Lieferung | Kostenlose Rückgabe,+31850250119,http://uwantisell.de,El. paštas nerastas,Uwantisell B.V. Grotenoord 4 3341 LT Hendrik-Ido-Ambacht Niederlande
https://www.trustedshops.de/bewertung/der-koelnshop-de,der-koelnshop.de,Im Köln Shop finden Sie echt Kölsche Souvenirs abseits von Zinntellern und Bierhumpen. Nehmen Sie Ihr Stück Köln aus dem Kölnshop mit nach Hause!,+49221346430,http://www.der-koelnshop.de,El. paštas nerastas,Kardinal-Höffner-Platz 1 50667 Köln Deutschland
https://www.trustedshops.de/bewertung/button-king-de,Button-King.de,"Button-King ist Ihr Hersteller für personalisierte Buttons und Magnete. Zudem erhalten Sie bei Button-King ein breites Angebot an weiteren personalisierten Produkten wie z.B. Ansteck-Buttons, Kleidungsmagnete, Kühlschrankmagnete, Magnete, Aufkleber und Textilien. Alle personalisierten Magnete und Buttons sind ""Made in Germany"". Button-King produziert Ihre personalisierte Ware bereits ab 1 bis 100.000 Stück und mehr innerhalb kurzer Zeit - und das direkt in Deutschland. So sind kurze Wege garantiert. Der Versand erfolgt deutschlandweit und in viele europäische Länder. Mit aktuell 32 Mitarbeiter:innen stellt Button-King sicher, dass Ihre Ware schnell und in hoher Qualität produziert und geliefert wird. Unsere Kunden sind Werbeagenturen, Unternehmen, Vereine und Privatleute. Sie erhalten zu jeder Bestellung einen kostenfreien Basis-Datencheck.",+493022012926,http://www.button-king.de,El. paštas nerastas,Oderstr. 63 14513 Teltow Deutschland
https://www.trustedshops.de/bewertung/place-x-de,Place-X,"Erlebe bequemes Shopping bei Place-X! Entdecke 100.000+ Produkte, inkl. Elektronik, Haushaltswaren, Küchenutensilien, Wohnaccessoires, Haustierbedarf und Garten-/Poolzubehör. Kostenloser Versand für alle Produkte, zuverlässiger, schneller Versand. Stöbere jetzt und verschönere dein Zuhause!",+4915150785897,http://place-x.de,El. paštas nerastas,Place-X Onlinehandel GbR Am Stadtpark 15 59174 Kamen Deutschland
https://www.trustedshops.de/bewertung/info_X9C854D45CC05B204F350E38708EC2660.html,attitudedeutschland.de,Aprašymas nerastas,+31299373670,http://www.attitudedeutschland.de,hello@attitudeholland.nl,V.O.F. Attitude Holland energiestraat 4e 1135GD EDAM Niederlande
https://www.trustedshops.de/bewertung/gitoparts-de,Gitoparts.de Onlineshop,"Wir bieten unzählige Produkte aus den Bereichen Haushalt, Möbel, Gartenarbeit, Heimwerkerbedarf, Elektronik, Beleuchtung, Sicherheits- und Abstütztechnik, Flächenschutz und mehr an. Unsere kompetenten und erfahrenen Mitarbeiter stehen für Sie jederzeit zur Verfügung. Gitoparts.de engagiert sich dafür, jeden Schritt des Einkaufserlebnisses angenehm zu gestalten- von der Produktsuche bis hin zur Lieferung. Gerne beraten und unterstützen wir Sie persönlich bei allen Fragen rund um unsere Produkte. Wir sind gern für Sie da.",+49687691199026,http://www.gitoparts.de,El. paštas nerastas,LuxTek GmbH Im Gewerbegebiet 19 66709 Weiskirchen Deutschland
https://www.trustedshops.de/bewertung/info_XEB74091054891A4C9CEC67B4EA6C1442.html,peruecken-online.com,Aprašymas nerastas,+4933541329615,http://www.peruecken-online.com,service@vk-event-fashion.com,VK Event Fashion GmbH Schubertstr. 53 15234 Frankfurt (Oder) Deutschland
https://www.trustedshops.de/bewertung/elbenwald-de,Elbenwald,"Elbenwald ist ein Einzelhandelsgeschäft, das sich auf Merchandise und Fanartikel aus der Popkultur spezialisiert hat. Das Sortiment umfasst Produkte zu beliebten Themen wie Star Wars, Harry Potter und Herr der Ringe. Neben einer Vielzahl von Artikeln bietet Elbenwald auch spezielle Kollektionen zu aktuellen Trends und saisonalen Anlässen an. Die Filialen sind in mehreren Städten vertreten und bieten ein ansprechendes Einkaufserlebnis für Fans und Sammler.",+49355121010,http://www.elbenwald.de,El. paštas nerastas,Am Seegraben 9-10 03051 Cottbus Deutschland
https://www.trustedshops.de/bewertung/goinsane-de,goinsane.de,"In diesem Shop findest du eine breite Auswahl an ausgefallener 50s Style und retro Kleidung und viele passende Accessoires... Vom klassischen Pencilkleid über 40er Jahre Bademode und extravaganten Handtaschen bis hin zu vintage inspirierten Blusen und Hosen uvm Keine Massenware sondern etwas ganz Besonderes bietet das Label SugarShock in Kleinauflage. Auch für die Herren der Schöpfung gibt es mit der Marke ""Fine49"" etwas cooles zum kleinen Preis.",+4993188059710,http://www.goinsane.de,El. paštas nerastas,Albert-Schweitzer-Str. 51 97204 Höchberg Deutschland
https://www.trustedshops.de/bewertung/tattoobrands-de,tattoobrands.de,Aprašymas nerastas,+4920951956233,http://www.tattoobrands.de,El. paštas nerastas,Seele Consulting & Management GmbH Aldenhofstraße 108 45883 Gelsenkirchen Deutschland
https://www.trustedshops.de/bewertung/suicideglam-com,Suicide Glam - Rockabilly 50s Retro Fashion,"40er 50er Jahre retro Fashion Rock n Roll! Herzlich Willkommen im Onlineshop für Rockabilly Bekleidung, retro Mode und jeder Menge Accessoires im Vintage Stil der Golden 50s. Seit bereits 2004 existiert Suicide Glam in Unterfranken. Bei uns findet Ihr eine riesige Auswahl an retro Kleidern, Petticoats, Röcken & Hosen im Stil der 40er und 50er Jahre. Vor allem das hauseigene Label SugarShock bietet euch ein breitgefächertes Sortiment. Die extra femininen Kleider, die teilweise nach original Schnitten aus dieser Zeit gefertigt wurden, setzen eure Kurven gekonnt in Szene. Doch was wäre das schönste Kleid ohne die entsprechenden Accessoires? Und auch hier führen wir alles, was den retro Look perfekt macht: Haarblüten, Handtaschen, Schmuck etc... Neben dem großen Angebot für die Mädels kümmern wir uns natürlich auch um die Herren der Schöpfung. Für die Jungs haben wir vor allem Hawaii Hemden, T-Shirts, Mützen & Hüte im coolen Rockabilly Style. Auch an unsere kleinen Rockabilly Bambinis wurde gedacht. In unserem Sortiment findet Ihr zuckersüße Babystrampler und Lätzchen von Six Bunnies oder Hotrod Hellcat. Wenn Ihr nach bekannten Marken wie z.B. SugarShock, Fine49, Hell Bunny, Banned, Liquor Brand, Rumble59, Dickies, Hearts & Roses London, Unique Vintage oder Belsira sucht, seid ihr bei uns genau richtig. Viel Spaß beim Stöbern!",+499314655336,http://www.suicideglam.com,El. paštas nerastas,Albert-Schweitzer-Str. 51 97204 Hoechberg Deutschland
https://www.trustedshops.de/bewertung/pierros-de,pierros.de,"Im Shop von pierros.de finden Sie ein breites Sortiment an Karnevalskostümen, Perücken, Schmuck und vielem mehr. Stellen Sie sich ein eigenes Kostüm zusammen oder wählen Sie eines aus einem bestimmten Themenbereich.",+49265140010,http://www.pierros.de,El. paštas nerastas,Pierros GmbH Koblenzer Straße 154 56727 Mayen Deutschland
https://www.trustedshops.de/bewertung/cosplayhero-de,cosplayhero.de,"CosplayHero ist ein Fachgeschäft, das sich auf die Bereitstellung von Kostümen, Accessoires und Requisiten für Cosplay-Enthusiasten konzentriert. Das Sortiment umfasst eine Vielzahl von Themen, darunter beliebte Anime-Serien wie Monogatari und Kakegurui. Neben klassischen Kostümen bietet der Shop auch handgefertigte Cosplay- und Perückenaufträge sowie 3D-Druckdienstleistungen an. CosplayHero richtet sich an Kunden, die Wert auf Detailtreue und Qualität legen, um ihre Charaktere authentisch darzustellen.",Telefonas nerastas,https://cosplayhero.de,El. paštas nerastas,
https://www.trustedshops.de/bewertung/karneval-attacke-de,karneval-attacke.de,"Karneval-Attacke.de ist ein Fachgeschäft für Kostüme, Perücken und Accessoires, das sich auf die Ausstattung für Karneval, Fasching und Halloween spezialisiert hat. Das Sortiment umfasst eine Vielzahl von Faschingsmasken, darunter Tiergesichter und venezianische Masken, sowie diverse Perücken für Damen und Herren. Ergänzt wird das Angebot durch Spielzeugwaffen und Gruseldekorationen, die für eine schaurige Atmosphäre sorgen. Die Produktpalette richtet sich an Kunden, die an Mottopartys oder festlichen Anlässen teilnehmen möchten.",Telefonas nerastas,https://karneval-attacke.de,El. paštas nerastas,
https://www.trustedshops.de/bewertung/firework-shop-de,firework-shop.de,"Firework-Shop.de bietet eine umfangreiche Auswahl an Feuerwerksartikeln, Pyrotechnik und Partybedarf. Das Sortiment umfasst verschiedene Feuerwerkskörper, die sich für Anlässe wie Hochzeiten, Partys und Silvester eignen. Neben Feuerwerk werden auch Produkte für die Eventgestaltung angeboten, darunter Partylautsprecher, LED-Lichter und Nebelmaschinen. Die Plattform ermöglicht es, diese Artikel bequem online zu bestellen und nach Hause liefern zu lassen.",Telefonas nerastas,https://firework-shop.de,El. paštas nerastas,
https://www.trustedshops.de/bewertung/gebrauchtwaren4you-de,gebrauchtwaren4you.de,In diesem Shop befindet sich gebrauchte Artikel in guten Zustand. Entdecken Sie eine große Auswahl gebrauchte Artikel.,+491786589383,http://gebrauchtwaren4you.de,El. paštas nerastas,Weberstr. 7 45879 Gelsenkirchen Deutschland
